{
  "schema": "sico.diagnostics.v0",
  "protocol_version": 0,
  "tool": { "name": "sico", "version": "0.0.0-fixture" },
  "coordinate_system": {
    "encoding": "utf-8",
    "byte_base": 0,
    "byte_end": "exclusive",
    "line_base": 1,
    "column_base": 1,
    "column_unit": "unicode-scalar-value"
  },
  "diagnostics": [
    {
      "id": "d1",
      "code": "E2001",
      "key": "TYPE_MISMATCH",
      "severity": "error",
      "kind": "root",
      "message": "expected User, found Option<User>",
      "arguments": { "expected": "User", "found": "Option<User>" },
      "file": "src/user.sico",
      "range": {
        "start": { "byte": 240, "line": 18, "column": 10 },
        "end": { "byte": 252, "line": 18, "column": 22 }
      },
      "hint": "handle none before using the value"
    },
    {
      "id": "d2",
      "code": "E5001",
      "key": "RESOURCE_MOVED",
      "severity": "error",
      "kind": "root",
      "message": "reader was moved to owned",
      "arguments": { "resource": "reader", "target": "owned" },
      "file": "src/user.sico",
      "range": {
        "start": { "byte": 410, "line": 27, "column": 3 },
        "end": { "byte": 416, "line": 27, "column": 9 }
      },
      "related": [
        {
          "file": "src/user.sico",
          "range": {
            "start": { "byte": 372, "line": 25, "column": 20 },
            "end": { "byte": 378, "line": 25, "column": 26 }
          },
          "message": "moved here"
        }
      ]
    }
  ],
  "summary": {
    "emitted": 2,
    "errors": 2,
    "warnings": 0,
    "info": 0,
    "suppressed": 0,
    "truncated": 0
  }
}
